{
  "fixed_test_run_id": "confirmatory_fixed_test_cord30_trainval_20260429",
  "run_id": "confirmatory_cord30_trainval_20260429",
  "attempt_id": "attempt_20260429_122155",
  "generated_at": "2026-04-29T12:25:29.391056+08:00",
  "candidate_scheme_id": "price_volume_single_signal_alpha158_cord30_v1",
  "research_round_id": "rr_confirmatory_alpha158_standalone_shortlist_round1_20260429",
  "stress_open_bp": 20.0,
  "stress_close_bp": 20.0,
  "effective_relative_days": 4132,
  "annual_relative_return": -0.07923845874225188,
  "pass_cost_stress_relative_return_floor": false
}
