{
  "fixed_test_run_id": "exploratory_multi_iw_v1",
  "run_id": "exploratory_multi_iw_v1",
  "attempt_id": "attempt_20260507_122945",
  "generated_at": "2026-05-07T12:32:15.297901+08:00",
  "candidate_scheme_id": "multi_ic_weighted_v1",
  "research_round_id": "rr_exploratory_multi_signal_composite_20260506",
  "stress_open_bp": 20.0,
  "stress_close_bp": 20.0,
  "effective_relative_days": 4132,
  "annual_relative_return": -0.044675646527846946,
  "pass_cost_stress_relative_return_floor": false
}
