{
  "fixed_test_run_id": "exploratory_power_inv_rev_a4_v1",
  "run_id": "exploratory_power_inv_rev_a4_v1",
  "attempt_id": "attempt_20260506_153253",
  "generated_at": "2026-05-06T15:35:16.593480+08:00",
  "candidate_scheme_id": "power_inv_rev_a4_v1",
  "research_round_id": "rr_exploratory_power_transform_reversal_20260506",
  "stress_open_bp": 20.0,
  "stress_close_bp": 20.0,
  "effective_relative_days": 4132,
  "annual_relative_return": -0.16964523935838527,
  "pass_cost_stress_relative_return_floor": false
}
