{
  "fixed_test_run_id": "fullchain_price_volume_remove_trend_consistency_20260422_135614",
  "run_id": "fullchain_price_volume_remove_trend_consistency_20260422_135614",
  "attempt_id": "attempt_20260422_135730",
  "generated_at": "2026-04-22T14:03:48.120106+08:00",
  "candidate_scheme_id": "price_volume_v16_remove_trend_consistency",
  "research_round_id": "rr_price_volume_remove_trend_consistency_family_20260422",
  "stress_open_bp": 20.0,
  "stress_close_bp": 20.0,
  "effective_relative_days": 5162,
  "annual_relative_return": -0.09345163994819183,
  "pass_cost_stress_relative_return_floor": false
}
