{
  "fixed_test_run_id": "exploratory_reversal_p98_corr30_trainval_20260506",
  "run_id": "exploratory_reversal_p98_corr30_trainval_20260506",
  "attempt_id": "attempt_20260506_122707",
  "generated_at": "2026-05-06T12:30:03.014230+08:00",
  "candidate_scheme_id": "reversal_p98_corr30_ew_v1",
  "research_round_id": "rr_exploratory_reversal_corr30_composite_20260506",
  "stress_open_bp": 20.0,
  "stress_close_bp": 20.0,
  "effective_relative_days": 4132,
  "annual_relative_return": -0.05362453647009757,
  "pass_cost_stress_relative_return_floor": false
}
