{
  "fixed_test_run_id": "fullchain_baseline_turnover_suppression_20260418_2358",
  "run_id": "fullchain_baseline_turnover_suppression_20260418_2358",
  "attempt_id": "attempt_20260418_234936",
  "generated_at": "2026-04-18T23:55:49.508229+08:00",
  "candidate_scheme_id": "baseline_momentum_v11_turnover_suppression",
  "research_round_id": "rr_baseline_turnover_suppression_20260418",
  "stress_open_bp": 20.0,
  "stress_close_bp": 20.0,
  "effective_relative_days": 5162,
  "annual_relative_return": -0.11755087664093089,
  "pass_cost_stress_relative_return_floor": false
}
