{
  "fixed_test_run_id": "confirmatory_fixed_test_imax20_trainval_20260430_round4",
  "run_id": "confirmatory_imax20_trainval_20260430_round4",
  "attempt_id": "attempt_20260430_153332",
  "generated_at": "2026-04-30T15:36:58.283629+08:00",
  "candidate_scheme_id": "price_volume_single_signal_alpha158_imax20_v1",
  "research_round_id": "rr_confirmatory_alpha158_high_invested_weight_head_extraction_shortlist_round4_20260430",
  "stress_open_bp": 20.0,
  "stress_close_bp": 20.0,
  "effective_relative_days": 4132,
  "annual_relative_return": -0.11971456614484466,
  "pass_cost_stress_relative_return_floor": false
}
